tutorial/miopen_cache/3935356/gfx90a6e.HIP.3_4_0_a583315f3-dirty.ufdb.txt
11-32-64-3x3-64-32-64-128-1x1-1x1-1x1-0-NCHW-BF16-F=ConvHipImplicitGemmGroupFwdXdlops:0.363522,39334400,miopenConvolutionFwdAlgoImplicitGEMM;ConvAsmImplicitGemmGTCDynamicFwdXdlopsNHWC:0.193762,106443264,miopenConvolutionFwdAlgoImplicitGEMM;GemmFwdRest:3.16793,405504,miopenConvolutionFwdAlgoGEMM;ConvDirectNaiveConvFwd:3.48768,0,miopenConvolutionFwdAlgoDirect
4-128-256-3x3-1-128-256-128-1x1-1x1-1x1-0-NCHW-BF16-F=ConvHipImplicitGemmGroupFwdXdlops:1.9476,41943296,miopenConvolutionFwdAlgoImplicitGEMM;ConvAsmImplicitGemmGTCDynamicFwdXdlopsNHWC:0.551653,50331904,miopenConvolutionFwdAlgoImplicitGEMM;GemmFwdRest:4.35382,2359296,miopenConvolutionFwdAlgoGEMM;ConvDirectNaiveConvFwd:1.66152,0,miopenConvolutionFwdAlgoDirect
11-32-64-4x4-512-8-16-128-0x0-4x4-1x1-0-NCHW-BF16-F=ConvHipImplicitGemmGroupFwdXdlops:0.251778,22724608,miopenConvolutionFwdAlgoImplicitGEMM;ConvAsmImplicitGemmGTCDynamicFwdXdlopsNHWC:0.161569,56279040,miopenConvolutionFwdAlgoImplicitGEMM;GemmFwdRest:4.81322,45056,miopenConvolutionFwdAlgoGEMM;ConvDirectNaiveConvFwd:4.95121,0,miopenConvolutionFwdAlgoDirect
1-32-64-3x3-64-32-64-128-1x1-1x1-1x1-0-NCHW-BF16-F=ConvHipImplicitGemmGroupFwdXdlops:0.230658,34080000,miopenConvolutionFwdAlgoImplicitGEMM;ConvAsmImplicitGemmGTCDynamicFwdXdlopsNHWC:0.124161,100663296,miopenConvolutionFwdAlgoImplicitGEMM;GemmFwdRest:2.83801,36864,miopenConvolutionFwdAlgoGEMM;ConvDirectNaiveConvFwd:0.400419,0,miopenConvolutionFwdAlgoDirect
11-32-64-3x3-64-32-64-35-1x1-1x1-1x1-0-NCHW-BF16-F=ConvHipImplicitGemmGroupFwdXdlops:0.137857,10764800,miopenConvolutionFwdAlgoImplicitGEMM;ConvAsmImplicitGemmGTCDynamicFwdXdlopsNHWC:0.0640326,29114880,miopenConvolutionFwdAlgoImplicitGEMM;GemmFwdRest:0.813766,405504,miopenConvolutionFwdAlgoGEMM;ConvDirectNaiveConvFwd:1.04462,0,miopenConvolutionFwdAlgoDirect
4-128-256-3x3-1-128-256-35-1x1-1x1-1x1-0-NCHW-BF16-F=ConvHipImplicitGemmGroupFwdXdlops:0.567589,11469056,miopenConvolutionFwdAlgoImplicitGEMM;ConvAsmImplicitGemmGTCDynamicFwdXdlopsNHWC:0.160449,13762816,miopenConvolutionFwdAlgoImplicitGEMM;GemmFwdRest:1.13425,2359296,miopenConvolutionFwdAlgoGEMM;ConvDirectNaiveConvFwd:1.24436,0,miopenConvolutionFwdAlgoDirect
11-32-64-4x4-512-8-16-35-0x0-4x4-1x1-0-NCHW-BF16-F=ConvHipImplicitGemmGroupFwdXdlops:0.116289,6344704,miopenConvolutionFwdAlgoImplicitGEMM;ConvAsmImplicitGemmGTCDynamicFwdXdlopsNHWC:0.0541444,15519744,miopenConvolutionFwdAlgoImplicitGEMM;GemmFwdRest:1.26673,45056,miopenConvolutionFwdAlgoGEMM;ConvDirectNaiveConvFwd:1.37585,0,miopenConvolutionFwdAlgoDirect
1-32-64-3x3-64-32-64-35-1x1-1x1-1x1-0-NCHW-BF16-F=ConvHipImplicitGemmGroupFwdXdlops:0.0904966,9319680,miopenConvolutionFwdAlgoImplicitGEMM;ConvAsmImplicitGemmGTCDynamicFwdXdlopsNHWC:0.0373124,27525120,miopenConvolutionFwdAlgoImplicitGEMM;GemmFwdRest:0.731301,36864,miopenConvolutionFwdAlgoGEMM;ConvDirectNaiveConvFwd:0.122433,0,miopenConvolutionFwdAlgoDirect
