tutorial/miopen_cache/3923145/gfx90a6e.HIP.3_4_0_a583315f3-dirty.ufdb.txt
11-128-256-3x3-4-128-256-128-1x1-1x1-1x1-0-NCHW-BF16-F=ConvHipImplicitGemmGroupFwdXdlops:3.50333,125830144,miopenConvolutionFwdAlgoImplicitGEMM;ConvAsmImplicitGemmGTCDynamicFwdXdlopsNHWC:1.18625,192939008,miopenConvolutionFwdAlgoImplicitGEMM;GemmFwdRest:5.5766,6488064,miopenConvolutionFwdAlgoGEMM;ConvDirectNaiveConvFwd:5.69766,0,miopenConvolutionFwdAlgoDirect
4-128-256-3x3-1-128-256-128-1x1-1x1-1x1-0-NCHW-BF16-F=ConvHipImplicitGemmGroupFwdXdlops:1.96053,41943296,miopenConvolutionFwdAlgoImplicitGEMM;ConvAsmImplicitGemmGTCDynamicFwdXdlopsNHWC:0.555814,50331904,miopenConvolutionFwdAlgoImplicitGEMM;GemmFwdRest:4.10734,2359296,miopenConvolutionFwdAlgoGEMM;ConvDirectNaiveConvFwd:1.66354,0,miopenConvolutionFwdAlgoDirect
11-128-256-8x8-128-16-32-128-0x0-8x8-1x1-0-NCHW-BF16-F=ConvHipImplicitGemmGroupFwdXdlops:0.771496,109232128,miopenConvolutionFwdAlgoImplicitGEMM;ConvAsmImplicitGemmGTCDynamicFwdXdlopsNHWC:0.613958,142786560,miopenConvolutionFwdAlgoImplicitGEMM;GemmFwdRest:8.14719,720896,miopenConvolutionFwdAlgoGEMM;ConvDirectNaiveConvFwd:36.5189,0,miopenConvolutionFwdAlgoDirect
1-128-256-3x3-4-128-256-128-1x1-1x1-1x1-0-NCHW-BF16-F=ConvHipImplicitGemmGroupFwdXdlops:1.3067,41943296,miopenConvolutionFwdAlgoImplicitGEMM;ConvAsmImplicitGemmGTCDynamicFwdXdlopsNHWC:0.422661,100663296,miopenConvolutionFwdAlgoImplicitGEMM;GemmFwdRest:3.58896,589824,miopenConvolutionFwdAlgoGEMM;ConvDirectNaiveConvFwd:0.621638,0,miopenConvolutionFwdAlgoDirect
11-128-256-3x3-4-128-256-35-1x1-1x1-1x1-0-NCHW-BF16-F=ConvHipImplicitGemmGroupFwdXdlops:0.998698,34407424,miopenConvolutionFwdAlgoImplicitGEMM;ConvAsmImplicitGemmGTCDynamicFwdXdlopsNHWC:0.339588,52757504,miopenConvolutionFwdAlgoImplicitGEMM;GemmFwdRest:1.52267,6488064,miopenConvolutionFwdAlgoGEMM;ConvDirectNaiveConvFwd:3.86785,0,miopenConvolutionFwdAlgoDirect
4-128-256-3x3-1-128-256-35-1x1-1x1-1x1-0-NCHW-BF16-F=ConvHipImplicitGemmGroupFwdXdlops:0.573862,11469056,miopenConvolutionFwdAlgoImplicitGEMM;ConvAsmImplicitGemmGTCDynamicFwdXdlopsNHWC:0.161569,13762816,miopenConvolutionFwdAlgoImplicitGEMM;GemmFwdRest:1.14244,2359296,miopenConvolutionFwdAlgoGEMM;ConvDirectNaiveConvFwd:1.25348,0,miopenConvolutionFwdAlgoDirect
11-128-256-8x8-128-16-32-35-0x0-8x8-1x1-0-NCHW-BF16-F=ConvHipImplicitGemmGroupFwdXdlops:0.304515,29999104,miopenConvolutionFwdAlgoImplicitGEMM;ConvAsmImplicitGemmGTCDynamicFwdXdlopsNHWC:0.189122,39174144,miopenConvolutionFwdAlgoImplicitGEMM;GemmFwdRest:2.22014,720896,miopenConvolutionFwdAlgoGEMM;ConvDirectNaiveConvFwd:10.2555,0,miopenConvolutionFwdAlgoDirect
1-128-256-3x3-4-128-256-35-1x1-1x1-1x1-0-NCHW-BF16-F=ConvHipImplicitGemmGroupFwdXdlops:0.392452,11469056,miopenConvolutionFwdAlgoImplicitGEMM;ConvAsmImplicitGemmGTCDynamicFwdXdlopsNHWC:0.122817,27525120,miopenConvolutionFwdAlgoImplicitGEMM;GemmFwdRest:0.979209,589824,miopenConvolutionFwdAlgoGEMM;ConvDirectNaiveConvFwd:0.431588,0,miopenConvolutionFwdAlgoDirect
