tutorial/miopen_cache/3935361/gfx90a6e.HIP.3_4_0_a583315f3-dirty.ufdb.txt
11-128-256-3x3-4-128-256-128-1x1-1x1-1x1-0-NCHW-BF16-F=ConvHipImplicitGemmGroupFwdXdlops:3.50859,125830144,miopenConvolutionFwdAlgoImplicitGEMM;ConvAsmImplicitGemmGTCDynamicFwdXdlopsNHWC:1.18676,192939008,miopenConvolutionFwdAlgoImplicitGEMM;GemmFwdRest:5.55859,6488064,miopenConvolutionFwdAlgoGEMM;ConvDirectNaiveConvFwd:5.70806,0,miopenConvolutionFwdAlgoDirect
4-128-256-3x3-1-128-256-128-1x1-1x1-1x1-0-NCHW-BF16-F=ConvHipImplicitGemmGroupFwdXdlops:1.96353,41943296,miopenConvolutionFwdAlgoImplicitGEMM;ConvAsmImplicitGemmGTCDynamicFwdXdlopsNHWC:0.556099,50331904,miopenConvolutionFwdAlgoImplicitGEMM;GemmFwdRest:4.10683,2359296,miopenConvolutionFwdAlgoGEMM;ConvDirectNaiveConvFwd:1.62023,0,miopenConvolutionFwdAlgoDirect
11-128-256-4x4-512-32-64-128-0x0-4x4-1x1-0-NCHW-BF16-F=ConvHipImplicitGemmGroupFwdXdlops:3.33592,360890368,miopenConvolutionFwdAlgoImplicitGEMM;ConvAsmImplicitGemmGTCDynamicFwdXdlopsNHWC:2.41956,897761280,miopenConvolutionFwdAlgoImplicitGEMM;GemmFwdRest:5.06323,720896,miopenConvolutionFwdAlgoGEMM;ConvDirectNaiveConvFwd:79.5372,0,miopenConvolutionFwdAlgoDirect
1-128-256-3x3-4-128-256-128-1x1-1x1-1x1-0-NCHW-BF16-F=ConvHipImplicitGemmGroupFwdXdlops:1.30935,41943296,miopenConvolutionFwdAlgoImplicitGEMM;ConvAsmImplicitGemmGTCDynamicFwdXdlopsNHWC:0.42365,100663296,miopenConvolutionFwdAlgoImplicitGEMM;GemmFwdRest:3.64447,589824,miopenConvolutionFwdAlgoGEMM;ConvDirectNaiveConvFwd:0.625731,0,miopenConvolutionFwdAlgoDirect
11-128-256-3x3-4-128-256-35-1x1-1x1-1x1-0-NCHW-BF16-F=ConvHipImplicitGemmGroupFwdXdlops:1.00048,34407424,miopenConvolutionFwdAlgoImplicitGEMM;ConvAsmImplicitGemmGTCDynamicFwdXdlopsNHWC:0.340834,52757504,miopenConvolutionFwdAlgoImplicitGEMM;GemmFwdRest:1.52254,6488064,miopenConvolutionFwdAlgoGEMM;ConvDirectNaiveConvFwd:3.84763,0,miopenConvolutionFwdAlgoDirect
4-128-256-3x3-1-128-256-35-1x1-1x1-1x1-0-NCHW-BF16-F=ConvHipImplicitGemmGroupFwdXdlops:0.570179,11469056,miopenConvolutionFwdAlgoImplicitGEMM;ConvAsmImplicitGemmGTCDynamicFwdXdlopsNHWC:0.162305,13762816,miopenConvolutionFwdAlgoImplicitGEMM;GemmFwdRest:1.11649,2359296,miopenConvolutionFwdAlgoGEMM;ConvDirectNaiveConvFwd:1.25441,0,miopenConvolutionFwdAlgoDirect
11-128-256-4x4-512-32-64-35-0x0-4x4-1x1-0-NCHW-BF16-F=ConvHipImplicitGemmGroupFwdXdlops:0.933381,98811904,miopenConvolutionFwdAlgoImplicitGEMM;ConvAsmImplicitGemmGTCDynamicFwdXdlopsNHWC:0.648003,245612544,miopenConvolutionFwdAlgoImplicitGEMM;GemmFwdRest:1.39057,720896,miopenConvolutionFwdAlgoGEMM;ConvDirectNaiveConvFwd:21.8247,0,miopenConvolutionFwdAlgoDirect
1-128-256-3x3-4-128-256-35-1x1-1x1-1x1-0-NCHW-BF16-F=ConvHipImplicitGemmGroupFwdXdlops:0.393762,11469056,miopenConvolutionFwdAlgoImplicitGEMM;ConvAsmImplicitGemmGTCDynamicFwdXdlopsNHWC:0.124129,27525120,miopenConvolutionFwdAlgoImplicitGEMM;GemmFwdRest:1.00029,589824,miopenConvolutionFwdAlgoGEMM;ConvDirectNaiveConvFwd:0.42717,0,miopenConvolutionFwdAlgoDirect
