tutorial/miopen_cache/3923159/gfx90a6e.HIP.3_4_0_a583315f3-dirty.ufdb.txt
11-128-256-3x3-64-128-256-128-1x1-1x1-1x1-0-NCHW-BF16-F=ConvHipImplicitGemmGroupFwdXdlops:5.33007,629158400,miopenConvolutionFwdAlgoImplicitGEMM;ConvAsmImplicitGemmGTCDynamicFwdXdlopsNHWC:3.07638,1702900224,miopenConvolutionFwdAlgoImplicitGEMM;GemmFwdRest:6.02377,6488064,miopenConvolutionFwdAlgoGEMM;ConvDirectNaiveConvFwd:57.3938,0,miopenConvolutionFwdAlgoDirect
4-512-1024-3x3-1-512-1024-128-1x1-1x1-1x1-0-NCHW-BF16-F=ConvHipImplicitGemmGroupFwdXdlops:30.6154,671088896,miopenConvolutionFwdAlgoImplicitGEMM;ConvAsmImplicitGemmGTCDynamicFwdXdlopsNHWC:8.76777,805306624,miopenConvolutionFwdAlgoImplicitGEMM;GemmFwdRest:28.0196,37748736,miopenConvolutionFwdAlgoGEMM;ConvDirectNaiveConvFwd:30.0768,0,miopenConvolutionFwdAlgoDirect
