tutorial/miopen_cache/3923105/gfx90a6e.HIP.3_4_0_a583315f3-dirty.ufdb.txt
11-128-256-3x3-4-128-256-128-1x1-1x1-1x1-0-NCHW-BF16-F=ConvHipImplicitGemmGroupFwdXdlops:3.47317,125830144,miopenConvolutionFwdAlgoImplicitGEMM;ConvAsmImplicitGemmGTCDynamicFwdXdlopsNHWC:1.17492,192939008,miopenConvolutionFwdAlgoImplicitGEMM;GemmFwdRest:5.54946,6488064,miopenConvolutionFwdAlgoGEMM;ConvDirectNaiveConvFwd:5.67584,0,miopenConvolutionFwdAlgoDirect
4-128-256-3x3-1-128-256-128-1x1-1x1-1x1-0-NCHW-BF16-F=ConvHipImplicitGemmGroupFwdXdlops:1.94222,41943296,miopenConvolutionFwdAlgoImplicitGEMM;ConvAsmImplicitGemmGTCDynamicFwdXdlopsNHWC:0.549795,50331904,miopenConvolutionFwdAlgoImplicitGEMM;GemmFwdRest:4.09957,2359296,miopenConvolutionFwdAlgoGEMM;ConvDirectNaiveConvFwd:1.64151,0,miopenConvolutionFwdAlgoDirect
11-128-256-8x8-128-16-32-128-0x0-8x8-1x1-0-NCHW-BF16-F=ConvHipImplicitGemmGroupFwdXdlops:0.76602,109232128,miopenConvolutionFwdAlgoImplicitGEMM;ConvAsmImplicitGemmGTCDynamicFwdXdlopsNHWC:0.608163,142786560,miopenConvolutionFwdAlgoImplicitGEMM;GemmFwdRest:8.07713,720896,miopenConvolutionFwdAlgoGEMM;ConvDirectNaiveConvFwd:36.1589,0,miopenConvolutionFwdAlgoDirect
1-128-256-3x3-4-128-256-128-1x1-1x1-1x1-0-NCHW-BF16-F=ConvHipImplicitGemmGroupFwdXdlops:1.29489,41943296,miopenConvolutionFwdAlgoImplicitGEMM;ConvAsmImplicitGemmGTCDynamicFwdXdlopsNHWC:0.41837,100663296,miopenConvolutionFwdAlgoImplicitGEMM;GemmFwdRest:3.55986,589824,miopenConvolutionFwdAlgoGEMM;ConvDirectNaiveConvFwd:0.618851,0,miopenConvolutionFwdAlgoDirect
