tutorial/miopen_cache/3923168/gfx90a6e.HIP.3_4_0_a583315f3-dirty.ufdb.txt
11-32-64-3x3-64-32-64-128-1x1-1x1-1x1-0-NCHW-BF16-F=ConvHipImplicitGemmGroupFwdXdlops:0.362753,39334400,miopenConvolutionFwdAlgoImplicitGEMM;ConvAsmImplicitGemmGTCDynamicFwdXdlopsNHWC:0.196224,106443264,miopenConvolutionFwdAlgoImplicitGEMM;GemmFwdRest:2.94612,405504,miopenConvolutionFwdAlgoGEMM;ConvDirectNaiveConvFwd:3.51582,0,miopenConvolutionFwdAlgoDirect
4-128-256-3x3-1-128-256-128-1x1-1x1-1x1-0-NCHW-BF16-F=ConvHipImplicitGemmGroupFwdXdlops:1.96368,41943296,miopenConvolutionFwdAlgoImplicitGEMM;ConvAsmImplicitGemmGTCDynamicFwdXdlopsNHWC:0.556417,50331904,miopenConvolutionFwdAlgoImplicitGEMM;GemmFwdRest:4.09674,2359296,miopenConvolutionFwdAlgoGEMM;ConvDirectNaiveConvFwd:1.63268,0,miopenConvolutionFwdAlgoDirect
11-32-64-8x8-128-4-8-128-0x0-8x8-1x1-0-NCHW-BF16-F=ConvHipImplicitGemmGroupFwdXdlops:0.180448,6995968,miopenConvolutionFwdAlgoImplicitGEMM;ConvAsmImplicitGemmGTCDynamicFwdXdlopsNHWC:0.116768,9093120,miopenConvolutionFwdAlgoImplicitGEMM;GemmFwdRest:6.25096,45056,miopenConvolutionFwdAlgoGEMM;ConvDirectNaiveConvFwd:2.68663,0,miopenConvolutionFwdAlgoDirect
1-32-64-3x3-64-32-64-128-1x1-1x1-1x1-0-NCHW-BF16-F=ConvHipImplicitGemmGroupFwdXdlops:0.232736,34080000,miopenConvolutionFwdAlgoImplicitGEMM;ConvAsmImplicitGemmGTCDynamicFwdXdlopsNHWC:0.123072,100663296,miopenConvolutionFwdAlgoImplicitGEMM;GemmFwdRest:2.63287,36864,miopenConvolutionFwdAlgoGEMM;ConvDirectNaiveConvFwd:0.403137,0,miopenConvolutionFwdAlgoDirect
11-32-64-3x3-64-32-64-35-1x1-1x1-1x1-0-NCHW-BF16-F=ConvHipImplicitGemmGroupFwdXdlops:0.137089,10764800,miopenConvolutionFwdAlgoImplicitGEMM;ConvAsmImplicitGemmGTCDynamicFwdXdlopsNHWC:0.064128,29114880,miopenConvolutionFwdAlgoImplicitGEMM;GemmFwdRest:0.803331,405504,miopenConvolutionFwdAlgoGEMM;ConvDirectNaiveConvFwd:1.05322,0,miopenConvolutionFwdAlgoDirect
4-128-256-3x3-1-128-256-35-1x1-1x1-1x1-0-NCHW-BF16-F=ConvHipImplicitGemmGroupFwdXdlops:0.575201,11469056,miopenConvolutionFwdAlgoImplicitGEMM;ConvAsmImplicitGemmGTCDynamicFwdXdlopsNHWC:0.161888,13762816,miopenConvolutionFwdAlgoImplicitGEMM;GemmFwdRest:1.12016,2359296,miopenConvolutionFwdAlgoGEMM;ConvDirectNaiveConvFwd:1.24944,0,miopenConvolutionFwdAlgoDirect
11-32-64-8x8-128-4-8-35-0x0-8x8-1x1-0-NCHW-BF16-F=ConvHipImplicitGemmGroupFwdXdlops:0.172192,2043904,miopenConvolutionFwdAlgoImplicitGEMM;ConvAsmImplicitGemmGTCDynamicFwdXdlopsNHWC:0.0880002,2617344,miopenConvolutionFwdAlgoImplicitGEMM;GemmFwdRest:1.70045,45056,miopenConvolutionFwdAlgoGEMM;ConvDirectNaiveConvFwd:0.800258,0,miopenConvolutionFwdAlgoDirect
1-32-64-3x3-64-32-64-35-1x1-1x1-1x1-0-NCHW-BF16-F=ConvHipImplicitGemmGroupFwdXdlops:0.0934402,9319680,miopenConvolutionFwdAlgoImplicitGEMM;ConvAsmImplicitGemmGTCDynamicFwdXdlopsNHWC:0.038304,27525120,miopenConvolutionFwdAlgoImplicitGEMM;GemmFwdRest:0.718338,36864,miopenConvolutionFwdAlgoGEMM;ConvDirectNaiveConvFwd:0.123232,0,miopenConvolutionFwdAlgoDirect
